{
  "$schema": "../visual-detail-evidence.schema.json",
  "schemaVersion": 1,
  "evidenceKind": "native-source",
  "platform": "react-native",
  "surfaceId": "example-native-surface",
  "nodes": [
    {
      "id": "side-node",
      "owner": "example-card",
      "kind": "card",
      "radius": 0,
      "borderWidth": 0,
      "shadowBlur": 0,
      "shadowSpread": 0,
      "accentEdges": [
        {
          "side": "left",
          "thickness": 3,
          "colorRole": "accent"
        }
      ],
      "backgroundPattern": "none",
      "patternDataMeaning": false,
      "accessoryWrapper": false,
      "declaresBorder": false,
      "declaresElevation": false
    },
    {
      "id": "rounded-node",
      "owner": "example-surface",
      "kind": "surface",
      "radius": 12,
      "borderWidth": 0,
      "shadowBlur": 0,
      "shadowSpread": 0,
      "accentEdges": [
        {
          "side": "top",
          "thickness": 3,
          "colorRole": "accent"
        }
      ],
      "backgroundPattern": "none",
      "patternDataMeaning": false,
      "accessoryWrapper": false,
      "declaresBorder": false,
      "declaresElevation": false
    },
    {
      "id": "shadow-node",
      "owner": "example-panel",
      "kind": "surface",
      "radius": 12,
      "borderWidth": 1,
      "shadowBlur": 24,
      "shadowSpread": 4,
      "accentEdges": [],
      "backgroundPattern": "none",
      "patternDataMeaning": false,
      "accessoryWrapper": false,
      "declaresBorder": true,
      "declaresElevation": true
    },
    {
      "id": "stripe-node",
      "owner": "example-stripes",
      "kind": "surface",
      "radius": 0,
      "borderWidth": 0,
      "shadowBlur": 0,
      "shadowSpread": 0,
      "accentEdges": [],
      "backgroundPattern": "repeating-stripes",
      "patternDataMeaning": false,
      "accessoryWrapper": false,
      "declaresBorder": false,
      "declaresElevation": false
    },
    {
      "id": "grid-node",
      "owner": "example-grid",
      "kind": "surface",
      "radius": 0,
      "borderWidth": 0,
      "shadowBlur": 0,
      "shadowSpread": 0,
      "accentEdges": [],
      "backgroundPattern": "grid",
      "patternDataMeaning": false,
      "accessoryWrapper": false,
      "declaresBorder": false,
      "declaresElevation": false
    }
  ]
}
